Name,Rating,Review,Address,Latitude and Longitude
"Actualize Consulting Engineers India Pvt Ltd., Bengaluru",4.0,165 Google reviews,"91Springboard,6th Floor, Trifecta Adatto, 21, ITPL Main Rd, Mahadevapura, Bengaluru, Karnataka 560048",
Name,Rating,Review,Address,Latitude and Longitude
Nimesa Technology Pvt. Ltd.,4.5,11 Google reviews,"NGR Arcade, #1567, 3rd Floor, 27th Main Road, Link Rd, BDA Layout, HSR Layout, Bengaluru, Karnataka 560102",
Name,Rating,Review,Address,Latitude and Longitude
Sulopa Technologies Pvt Ltd,4.8,39 Google reviews,"46, Novel Tech Park, 4, Hosur Rd, Kudlu Gate, HSR Extension, Hosapalaya, Bengaluru, Karnataka 560068",
